{
  "validatedFile": "repo-handoff.json",
  "validatedAt": "2026-04-05T17:40:25.423Z",
  "schema": "repo-builder-agent\\repo-handoff.schema.json",
  "status": "warn",
  "summary": {
    "totalChecks": 16,
    "passed": 13,
    "warnings": 3,
    "failures": 0
  },
  "checks": [
    {
      "id": "schema-compliance",
      "category": "schema",
      "label": "JSON Schema Compliance",
      "status": "pass",
      "message": "Handoff file is fully compliant with repo-handoff.schema.json.",
      "severity": "error"
    },
    {
      "id": "semantic-worker-queue",
      "category": "semantic",
      "label": "Worker Service Has Queue",
      "status": "pass",
      "message": "Worker service detected and infrastructure.queue is \"BullMQ\".",
      "severity": "error"
    },
    {
      "id": "semantic-monorepo-packages",
      "category": "semantic",
      "label": "Monorepo Has Packages",
      "status": "pass",
      "message": "Monorepo declared with 2 package(s) defined.",
      "severity": "error"
    },
    {
      "id": "semantic-payment-secret-scan",
      "category": "semantic",
      "label": "Payment Integration: Secret Scanning",
      "status": "pass",
      "message": "Payment integration detected and security.secretScanningEnabled is true.",
      "severity": "error"
    },
    {
      "id": "security-secret-scanning",
      "category": "security",
      "label": "Secret Scanning Enabled",
      "status": "pass",
      "message": "security.secretScanningEnabled is true (.gitleaks.toml or equivalent present).",
      "severity": "warning"
    },
    {
      "id": "security-md-included",
      "category": "security",
      "label": "SECURITY.md Included",
      "status": "pass",
      "message": "security.securityMdIncluded is true (SECURITY.md present in repo).",
      "severity": "warning"
    },
    {
      "id": "security-gitignore",
      "category": "security",
      "label": ".gitignore Comprehensive",
      "status": "pass",
      "message": "security.gitignoreComprehensive is true.",
      "severity": "warning"
    },
    {
      "id": "security-ci-scan",
      "category": "security",
      "label": "CI Security Scan Step",
      "status": "pass",
      "message": "security.ciSecurityScanStep is true (npm audit / pip-audit step in CI).",
      "severity": "info"
    },
    {
      "id": "completeness-assumptions-declared",
      "category": "completeness",
      "label": "Assumptions Declared",
      "status": "pass",
      "message": "8 assumption(s) declared by the producing agent.",
      "severity": "warning"
    },
    {
      "id": "completeness-project-name",
      "category": "completeness",
      "label": "Project Name Meaningful",
      "status": "pass",
      "message": "project.name is \"BriefBoard\".",
      "severity": "warning"
    },
    {
      "id": "completeness-services-declared",
      "category": "completeness",
      "label": "Backend Services Declared",
      "status": "pass",
      "message": "2 service(s) declared: 1 API, 1 worker.",
      "severity": "warning"
    },
    {
      "id": "playbook-security-md",
      "category": "security",
      "label": "Security Playbook: SECURITY.md",
      "status": "pass",
      "message": "security.securityMdIncluded is true. SECURITY.md file will be scaffolded.",
      "severity": "error"
    },
    {
      "id": "playbook-secret-scanning-sensitive",
      "category": "security",
      "label": "Security Playbook: Secret Scanning for Payment/Auth",
      "status": "pass",
      "message": "Payment/auth integration found and secret scanning is enabled.",
      "severity": "error"
    },
    {
      "id": "observability-health-endpoints-planned",
      "category": "completeness",
      "label": "Observability: Health Endpoints Planned",
      "status": "warn",
      "message": "API service(s) detected but observability.healthEndpointsPlanned is not true. All API services must expose /health/live and /health/ready endpoints.",
      "severity": "warning",
      "field": "observability.healthEndpointsPlanned"
    },
    {
      "id": "observability-distributed-tracing",
      "category": "completeness",
      "label": "Observability: Distributed Tracing",
      "status": "warn",
      "message": "2 services detected but observability.distributedTracing is not true. Add OTel SDK with OTLPTraceExporter across all services.",
      "severity": "warning",
      "field": "observability.distributedTracing"
    },
    {
      "id": "observability-structured-logging",
      "category": "completeness",
      "label": "Observability: Structured Logging",
      "status": "warn",
      "message": "Deployment target \"railway\" is set but observability.structuredLogging is not true. Production deployments require structured JSON logging (Pino, structlog, winston).",
      "severity": "info",
      "field": "observability.structuredLogging"
    }
  ],
  "blockingFailures": [],
  "warnings": [
    "observability-health-endpoints-planned",
    "observability-distributed-tracing",
    "observability-structured-logging"
  ],
  "meta": {
    "validatorVersion": "2.0.0",
    "pipelineStage": "backend-to-repo",
    "commandUsed": "/validate repo"
  }
}